,created_at,full_text,party,screen_name
2773,Thu Jun 14 15:11:17 +0000 2018,"HAPPENING NOW: Chatting with @WRCB about #tariffs, #TrumpKimSummit, &amp; the #CongressionalBaseballGame https://t.co/7YcikiR2tX",republicans,RepChuck
2774,Thu Jun 14 13:42:04 +0000 2018,RT @USDA: Happy #NationalFlagDay! https://t.co/o5RfopHjIr,republicans,RepChuck
2775,Thu Jun 14 13:23:51 +0000 2018,RT @ABensonIJ: @RepJeffDuncan @RepChuck @RodneyDavis @RepRWilliams could have been murdered last year - knowledge they carry daily. But tod…,republicans,RepChuck
2776,Thu Jun 14 13:14:10 +0000 2018,RT @RepDavidKustoff: Happy birthday to my friend and our great President @realDonaldTrump! #MAGA https://t.co/nSPKGPj32Y,republicans,RepChuck
2777,Thu Jun 14 12:23:19 +0000 2018,Your 2018 GOP Baseball Team ⚾️Happy to have my friend @SteveScalise &amp; @CapitolPolice Officer David Bailey with us this morning. They are our heroes. @thehillbaseball https://t.co/6B5GvMtu9Z,republicans,RepChuck
2778,Thu Jun 14 11:33:44 +0000 2018,RT @newschannelnine: WATCH LIVE: You may spot a suited-up @RepChuck: https://t.co/OsllhqQH4B,republicans,RepChuck
2779,Thu Jun 14 11:14:25 +0000 2018,"Good morning, it's game day! ⚾️ @thehillbaseball https://t.co/G5b9mAils6",republicans,RepChuck
2780,Wed Jun 13 17:02:18 +0000 2018,"RT @TNELECTRIC: Important votes, long committee meetings, and the Congressional Baseball team - all in a day for @RepChuck at the US Capito…",republicans,RepChuck
2781,Wed Jun 13 16:56:00 +0000 2018,Great to visit w/ @youthtourTN students from @TNELECTRIC this morning. We spoke about the work that happens in Washington &amp; I hope they continue their interest in the important service co-ops provide to #TN communities. Enjoy your Capitol tour! https://t.co/G0RbzpzF3w,republicans,RepChuck
2782,Wed Jun 13 14:33:49 +0000 2018,"RT @SBGC2C: .@RepChuck on #TrumpKimSummit: ""The people of east Tennessee who for years have worked on nonproliferation issues can feel safe…",republicans,RepChuck
2783,Wed Jun 13 14:07:04 +0000 2018,Discussing the #TrumpKimSummit &amp; #tariffs this morning with @newschannelnine @SBGC2C https://t.co/Q4t9fprPiG,republicans,RepChuck
2784,Tue Jun 12 16:05:48 +0000 2018,"Last night, @realDonaldTrump exemplified what it means to be a leader, becoming the first sitting U.S. president to meet with a North Korean head of state.

My full statement in recognition of the historic #TrumpKimSummit as we move towards #denuclearization of the Peninsula: https://t.co/wJmFT2NKDX",republicans,RepChuck
2785,Tue Jun 12 14:22:24 +0000 2018,"Thanks to the diplomatic leadership of @POTUS @realDonaldTrump yesterday's #TrumpKimSummit was an undeniable, historical moment for "" ...the promotion of peace, prosperity, and security of the Korean Peninsula and of the world."" https://t.co/5p7IJkrY86",republicans,RepChuck
2786,Tue Jun 12 14:00:34 +0000 2018,RT @HouseGOP: RT to wish #41 a very happy birthday! https://t.co/liKJiDqrLJ,republicans,RepChuck
2787,Mon Jun 11 13:59:52 +0000 2018,The countdown to the #TrumpKim summit is on. #ICYMI I shared my thoughts this weekend on the #SingaporeSummit and ultimate goal of #denuclearization of the Korean Peninsula. WATCH: https://t.co/kSJmnyzFj1,republicans,RepChuck
2788,Fri Jun 08 19:41:58 +0000 2018,"History was made today at @ORNL with the introduction of Summit, the the world's smartest &amp; most powerful supercomputer. Read the statements from @ENERGY @SecretaryPerry and I about what Summit means for American leadership and innovation → https://t.co/igsLFETPam",republicans,RepChuck
2789,Fri Jun 08 17:24:26 +0000 2018,"Honored to have you in #TN03 for this historic event, @SecretaryPerry! https://t.co/7cG5KFuotO",republicans,RepChuck
2790,Fri Jun 08 16:31:44 +0000 2018,"PASSED: The first package of 2019 #Appropriations bills. Read my full statement on how the House is working hard to address the national &amp; nuclear security needs of our nation, give peace of mind to our veterans, &amp; provide for our military: https://t.co/nYA450r7ac",republicans,RepChuck
2791,Thu Jun 07 16:25:16 +0000 2018,"RT @SpeakerRyan: Retweet to join me in wishing our @VP, Mike Pence, a very happy birthday🎉 https://t.co/DUriUgG3aD",republicans,RepChuck
2792,Thu Jun 07 16:04:34 +0000 2018,"From farm → table, our ranchers &amp; producers play an integral role in our economic development &amp; daily life.  Excellent meeting yesterday discussing livestock markets with #Tennessean Will Mayfield participating in @BeefUSA #YCC2018. https://t.co/kbI1BZ5Lm4",republicans,RepChuck
2793,Thu Jun 07 13:46:23 +0000 2018,"Proud to have voted for this key legislation that will support water resource infrastructure in #TN03 - the #Chickamauga Lock.

ICYMI: I toured the Lock with @USACEHQ a couple months ago: https://t.co/rcbUEfZ361 https://t.co/IjWC1yqpbb",republicans,RepChuck
2794,Wed Jun 06 21:13:31 +0000 2018,"RT @realDonaldTrump: We must always protect those who protect us. Today, it was my great honor to sign the #VAMissionAct and to make Vetera…",republicans,RepChuck
2795,Wed Jun 06 17:40:39 +0000 2018,"#Tennessee is home to over 400,000 veterans that have served our nation. Today, with the signing of the #VAMISSIONAct, we can better serve them. https://t.co/kKk3ISUrYy",republicans,RepChuck
2796,Wed Jun 06 14:07:44 +0000 2018,"It was great to welcome my friend, colleague, and teammate @stevescalise back on the ball field at practice this morning!",republicans,RepChuck
2797,Wed Jun 06 13:43:25 +0000 2018,"74 years ago today, American, British, Canadian and other Allied forces stormed Fortress Europe with unwavering courage and wholehearted dedication. Let us never forget the soldiers, sailors, and airmen who rose to the challenge with the eyes of the world upon them on #DDay. https://t.co/ihWCVtA437",republicans,RepChuck
2798,Tue Jun 05 21:59:29 +0000 2018,"Exciting news – submissions are NOW being accepted for the Congressional App Challenge! #STEM education is strong in #TN03 and all middle and high school students are welcome to showcase their talents. More information: 

https://t.co/ZONkyw4WbG

https://t.co/8acw0lqWfE https://t.co/HL2R1xEWt6",republicans,RepChuck
2799,Tue Jun 05 14:53:50 +0000 2018,The #ManhattanProject changed the world &amp; the images captured by Mr. Westcott provide insight into a unique time in our history. We thank him for preserving the legacy of the #SecretCity &amp; I truly believe he deserves the Presidential Medal of Freedom. https://t.co/pHHpiMZ8R1,republicans,RepChuck
2800,Sat Jun 02 00:13:50 +0000 2018,Just wrapped the 23rd @ValleyCorridor summit. Great to discuss topics from advanced manufacturing to #workforce development. Thanks to everyone who made this event a success - see you next year in #Chattanooga! https://t.co/3hxVZakOOI,republicans,RepChuck
2801,Fri Jun 01 17:40:59 +0000 2018,RT @wbir: Happy Birthday Tennessee! The Volunteer State turns 222 https://t.co/5EnuCOdM0T https://t.co/iE82vXIdcA,republicans,RepChuck
2802,Fri Jun 01 17:39:57 +0000 2018,"Today, our great state celebrates 222 years of statehood. Happy Birthday #Tennessee!

My full statement: https://t.co/e4vR28bJiL",republicans,RepChuck
2803,Wed May 30 19:27:35 +0000 2018,Over 1 million lives are lost to terminal illnesses every year. Today @POTUS signed #RightToTry to give terminally ill patients opportunity &amp; hope. I support this effort because everyone deserves the #RightToTry.,republicans,RepChuck
2804,Tue May 29 23:44:30 +0000 2018,HAPPENING NOW: Kicking off the 23rd #TennesseeValleyCorridor summit! https://t.co/sbnE99wMGY,republicans,RepChuck
2805,Tue May 29 22:25:30 +0000 2018,"As temperatures heat up during the summer months, there is no better time to bring awareness to the dangers of skin cancer. My wife shared prevention tips &amp; detection methods in her recent op-ed. 

Read it here → https://t.co/m3YzzGsyxu",republicans,RepChuck
2806,Mon May 28 15:46:44 +0000 2018,RT @newschannelnine: WATCH: @RepChuck Fleischmann speaks at Chattanooga's Memorial Day ceremony: https://t.co/AHvgJ9FfUV https://t.co/lNgFl…,republicans,RepChuck
2807,Mon May 28 12:58:30 +0000 2018,"On #MemorialDay we honor the brave men &amp; women who lost their lives in service to our nation. We remember the loved ones &amp; friends who are no longer w/ us in person, but forever w/ us in spirit. We are eternally grateful for the patriotism and sacrifice of these American heroes.",republicans,RepChuck
2808,Fri May 25 16:59:15 +0000 2018,"we must be willing to walk away, and I applaud @realDonaldTrump for doing so.",republicans,RepChuck
2809,Fri May 25 16:58:32 +0000 2018,...three Americans are home because of these negotiations. That is a fact &amp; a win for America. I am hopeful that the lines of communication will remain open &amp; the Administration will continue to implement power through strength in their maximum pressure campaign. However...,republicans,RepChuck
2810,Fri May 25 16:57:31 +0000 2018,"I believe @realDonaldTrump made the correct decision to cancel the upcoming #Summit. The U.S. has shown that we are willing to come to the table in a diplomatic manner, if &amp; when North Korea is willing to do so. Negotiations with #NorthKorea have been beneficial... https://t.co/BR9GRUzv5V",republicans,RepChuck
2811,Thu May 24 15:12:27 +0000 2018,RT @SpeakerRyan: Great news→ This year’s National Defense Authorization Act just passed the House with overwhelming bipartisan support. We…,republicans,RepChuck
2812,Fri May 18 16:24:32 +0000 2018,"RT @WhiteHouse: ""We grieve for the terrible loss of life and send our support and love to everyone affected by this absolutely horrific att…",republicans,RepChuck
2813,Fri May 18 16:08:53 +0000 2018,My deepest sympathies are with all who are suffering from the tragic shooting at Santa Fe High School. Tennesseans stand with you and are praying for you.,republicans,RepChuck
2814,Tue May 15 21:17:53 +0000 2018,Great meeting you! https://t.co/iTcF0T1xvC,republicans,RepChuck
2815,Tue May 15 17:37:23 +0000 2018,"In the most dangerous of situations &amp; during the most trying of times, our friends in blue are on the front lines.  Today on #PeaceOfficersMemorialDay I honor the lives lost in the line of duty. During #PoliceWeek I pray for the safety of every officer as they protect &amp; serve. https://t.co/QmScEXeVBA",republicans,RepChuck
2816,Mon May 14 18:12:25 +0000 2018,Our longstanding alliance w/ #Israel is characterized by respect for peace &amp; sovereignty. I congratulate Israel on 70 years of statehood &amp; join them in celebrating the opening of the #JerusalemEmbassy. The embassy is another @realDonaldTrump promise kept. https://t.co/4IztdNVeez,republicans,RepChuck
2817,Sun May 13 14:59:31 +0000 2018,"Happy #MothersDay Day to my wife, Brenda, and all the wonderful mothers out there! Your hard work, compassion, and selflessness deserves to be recognized every day, and especially today. https://t.co/kXqwvCQdvV",republicans,RepChuck
2818,Thu May 10 16:13:45 +0000 2018,"Next week, I will join in the 70th anniversary celebration of the State of #Israel. In light of this occasion, I was proud to support H. Res. 835 and reaffirm my longstanding commitment and friendship with the Israeli people. https://t.co/jbLPsFPPy2",republicans,RepChuck
2819,Thu May 10 13:58:19 +0000 2018,"Thank you for your sincere act of kindness and generosity, Officer Kelly! https://t.co/aaAsOJzHB1",republicans,RepChuck
2820,Thu May 10 13:09:00 +0000 2018,"RT @realDonaldTrump: On behalf of the American people, WELCOME HOME! https://t.co/hISaCI95CB",republicans,RepChuck
2821,Tue May 08 21:55:26 +0000 2018,"Teachers do more than teach – they are mentors, role models, and friends. This #TeacherAppreciationDay join me in thanking all the wonderful educators that work hard to help our young people be their best and brightest.",republicans,RepChuck
2822,Tue May 08 21:04:38 +0000 2018,"The #IranDeal has always been a serious cause for concern. In fact, in 2015 I wrote an Op-Ed in opposition to the deal &amp; three years later I have not wavered in my stance. More on my support of @POTUS announcement to withdraw from the Iran Deal: https://t.co/Fu1TQiFtZp",republicans,RepChuck
2823,Sat Apr 28 13:00:03 +0000 2018,"The importance of dental care goes beyond cavities. In fact, it's also about cancer prevention. My wife discusses more in her op-ed that you can read right here: https://t.co/eznonHQrxx",republicans,RepChuck
2824,Fri Apr 27 20:46:25 +0000 2018,I encourage you to join in. It can be as simple as going through your medicine cabinet and disposing of old or unwanted prescription drugs. Together we can prevent drug abuse in our homes and communities. Find more information: https://t.co/jdVKkFnimW,republicans,RepChuck
2825,Fri Apr 27 20:45:59 +0000 2018,Tomorrow is National Drug #TakeBackDay . Take a look at the efforts happening to combat the #OpioidEpidemic in #TN03 → https://t.co/CNXuIhFKyK,republicans,RepChuck
2826,Fri Apr 27 18:40:36 +0000 2018,The #FAA Reauthorization Act of 2018 is a step forward in upholding the gold standard for our nation's #infrastructure. I was proud to offer two amendments included in this legislation aimed to improve our airports &amp; ensure our skies are safe to travel → https://t.co/8gHnDZMjxk,republicans,RepChuck
2827,Thu Apr 26 21:44:29 +0000 2018,"Best of luck to the students from Oak Ridge High School competing in the @ENERGY National Science Bowl this weekend. You all are already winners in my book &amp; making #TN03 proud! @DOE_SC_NSB #nsb2018 

MORE: https://t.co/qn2uvD6uZ8",republicans,RepChuck
2828,Wed Apr 25 16:46:35 +0000 2018,This morning I joined my teammates for the first GOP baseball practice of the 2018 season. I am thankful for chance to get back out on the ball field and join my colleagues in celebrating America’s pastime. Let’s play ball! https://t.co/fswBh79gv9,republicans,RepChuck
2829,Mon Apr 23 22:10:11 +0000 2018,RT @HouseGOP: RT to wish the @USArmyReserve a very happy birthday! #USARBirthday110 https://t.co/4oE4aaS7Wf,republicans,RepChuck
2830,Mon Apr 23 19:42:17 +0000 2018,RT @MNPDNashville: BREAKING: Travis Reinking apprehended moments ago in a wooded area near Old Hickory Blvd &amp; Hobson Pk. https://t.co/00ukg…,republicans,RepChuck
2831,Sun Apr 22 22:04:39 +0000 2018,"I pray for the families &amp; friends affected by the senseless shooting this morning at the Waffle House in Antioch, TN. Thank you to the first responders and courageous patron, James Shaw Jr., for your heroic actions during this tragic event.",republicans,RepChuck
2832,Fri Apr 20 21:59:15 +0000 2018,"Today, it was announced that Bradley County, TN is the recipient of a Veterans Home Construction Grant totaling over $26 million for the future Bradley County Tennessee State Veterans Home. This is great news for #TN03 veterans. My full statement: https://t.co/q5RspSOfkg https://t.co/tDeDFBmwH6",republicans,RepChuck
2833,Thu Apr 19 18:17:56 +0000 2018,"It was my pleasure to meet w/ @ChattanoogaSLC to discuss solutions to prevent school violence. While we may not agree on everything, I was incredibly impressed w/ their suggestions, questions, &amp; concerns. I hope we can continue our dialogue in the future–safe travels back to #TN! https://t.co/tzvu2ICv7R",republicans,RepChuck
2834,Wed Apr 18 18:24:13 +0000 2018,Always great visiting with you! https://t.co/lWf2Fa6Fg4,republicans,RepChuck
2835,Wed Apr 18 00:38:05 +0000 2018,"Extremely saddened to hear about the passing of Former First Lady Barbara Bush. She was loved by her family, the state of Texas, and the nation. I send my condolences to the Bush family and will keep them in my prayers.",republicans,RepChuck
2836,Tue Apr 17 21:11:50 +0000 2018,"ICYMI: Although I was contacted by the Eastern Band of Cherokee Indians years ago, their story begins long before. Watch as I share part of their story on the @HouseFloor discussing my bill, the Eastern Band of Cherokee Historic Lands Reacquisition Act → https://t.co/0yaNNFnqDu",republicans,RepChuck
2837,Tue Apr 17 14:00:32 +0000 2018,"Tennesseans, it’s #TaxDay. Remember to file your taxes and say farewell to our old, broken, &amp; complicated tax code. Next year, #TaxDay will be more fair &amp; simple thanks to the #TaxCutsandJobsAct. https://t.co/n5V3rhnTc4",republicans,RepChuck
2838,Mon Apr 16 23:18:51 +0000 2018,"PASSED: My bill #HR146, the Eastern Band of Cherokee Historic Lands Reacquisition Act. I am proud the House voted to keep our promise to the Eastern Band of Cherokee Indians. MORE: https://t.co/FQrvgGDFWp

Now, let's get this bill through the Senate &amp; to @realDonaldTrump's desk!",republicans,RepChuck
2839,Mon Apr 16 21:34:47 +0000 2018,"I just spoke on the @HouseFloor about my bill #HR146, the Eastern Band of Cherokee Historic Lands Reacquisition Act. This bill is about a promise that was made to the Eastern Band of Cherokee Indians. Tonight, let's keep that promise. I spoke w/ @CameronWRCB about #HR146. WATCH: https://t.co/irpJeAYoIt",republicans,RepChuck
2840,Sat Apr 14 02:44:07 +0000 2018,I support @POTUS @realDonaldTrump response to the malicious attack in #Syria. My full statement: https://t.co/3f7TovwdB6,republicans,RepChuck
2841,Thu Apr 12 21:53:59 +0000 2018,"On #HolocaustRemembranceDay I reflect on my visit to Auschwitz-Birkenau. Walking the grounds where countless lives were stolen, a story was told about a gruesome time in history. Let us remember &amp; honor those who were horrifically killed &amp; always stand with our Jewish friends. https://t.co/y9uzmjXW3j",republicans,RepChuck
2842,Thu Apr 12 18:37:57 +0000 2018,RT @realDonaldTrump: Thank you to all of the American workers who travelled here today! This event is dedicated to YOU: the hardworking Ame…,republicans,RepChuck
2843,Thu Apr 12 17:08:37 +0000 2018,"Heading to the White House to join @realDonaldTrump for remarks on the benefits of #taxreform on American workers. I spent the last 2 weeks in #TN03, talking w/ Tennesseans about these benefits - their paychecks went up, they have more $ for family vacations, &amp; the list goes on!",republicans,RepChuck
2844,Thu Apr 12 13:53:29 +0000 2018,Great speaking with you this morning! https://t.co/mUivYmRvHo,republicans,RepChuck
2845,Wed Apr 11 19:57:50 +0000 2018,"Today @NIHDirector testified before @HouseAppropsGOP Labor, Health and Human Services, Education, &amp; Related Agencies Subcommittee regarding the #FY19budget request. My questions involved the men and women at @ORNL and the #opioidcrisis. 

WATCH: https://t.co/zawy5YAXy7",republicans,RepChuck
2846,Wed Apr 11 16:33:15 +0000 2018,".@SpeakerRyan is a patriot, leader, colleague, and friend. I wish him well in his retirement as he enjoys more time in the best role – that of a husband and father. My full statement → https://t.co/CYcn4DcZMp",republicans,RepChuck
2847,Tue Apr 10 16:12:28 +0000 2018,"Yesterday, I had the pleasure of joining @NashvilleCorps and @TVAnews to view progress &amp; receive updates on the #Chickamauga Lock. #TN03 is home to countless businesses and I am optimistic that, upon completion, this project will be great for both current &amp; future business. MORE: https://t.co/izWvnJu7j0",republicans,RepChuck
2848,Wed Apr 04 20:40:25 +0000 2018,"RT @SteveScalise: 50 years after his death, Dr. King's powerful message of love and equality continues to inspire millions. #MLK50 https://…",republicans,RepChuck
2849,Wed Apr 04 13:44:34 +0000 2018,"ICYMI: I joined @MorningsMaria on @FoxBusiness to talk #tariffs, government spending, and more. The full story → https://t.co/lWzbq93OnT",republicans,RepChuck
2850,Wed Apr 04 00:06:08 +0000 2018,RT @MariaBartiromo: Start smart tmrw 6-9am ET @MorningsMaria @FoxBusiness  w @dagenmcdowell John Negroponte frmr amb to #Honduras #Mexico #…,republicans,RepChuck
2851,Mon Apr 02 17:16:07 +0000 2018,Thank you @POTUS @realDonaldTrump for your commitment to the ASD community. #WorldAutismAwarenessDay https://t.co/Dc7JW2tBhM,republicans,RepChuck
2852,Sun Apr 01 14:56:10 +0000 2018,Brenda and I wish everyone a blessed #EasterSunday. https://t.co/pDII6Zgw3I,republicans,RepChuck
2853,Sat Mar 31 01:07:12 +0000 2018,"As the sunsets, #Passover2018 begins a very holy time in the Jewish religion. I was honored to join my Jewish friends in #Chattanooga this evening. #ChagSameach! https://t.co/sp7LkeRHi0",republicans,RepChuck
2854,Fri Mar 30 21:37:04 +0000 2018,Joining friends and families in #TN03 to observe #GoodFriday in remembrance of the sacrifice of our Lord and Savior.,republicans,RepChuck
2855,Fri Mar 30 17:41:31 +0000 2018,"This March I encourage you to talk about colorectal cancer, it could be a conversation that may save your life. Read about risk factors, prevention, and more in my wife’s op-ed: https://t.co/aUlUKi2uc3",republicans,RepChuck
2856,Thu Mar 29 21:40:43 +0000 2018,Our country’s veterans are our best – their courage and sacrifice unmatched. It was my honor to observe #VietnamWarVeteransDay with @McMinnTN Veterans. https://t.co/H6fndYxc7T,republicans,RepChuck
2857,Mon Mar 26 18:17:00 +0000 2018,"If you are planning a visit to D.C. for Spring Break please allow my office to schedule a tour of the @uscapitol for you. We also have information on tours of the @librarycongress, Supreme Court, and more. For details → https://t.co/im4dszbFa6",republicans,RepChuck
2858,Thu Mar 22 17:27:50 +0000 2018,"What is in the #FY18Omnibus: the largest increase in defense spending in 15 years, $4 billion in funding to fight the toxic #OpioidEpidemic, full funding for the Chickamauga Lock – a vital piece of TN03 #infrastructure. My full statement → https://t.co/3VT23FoumK",republicans,RepChuck
2859,Thu Mar 22 16:44:22 +0000 2018,"RT @HouseAppropsGOP: The FY18 Omnibus makes the largest investment to date - approximately $4 billion - to fight opioid abuse, which @POTUS…",republicans,RepChuck
2860,Wed Mar 21 16:20:01 +0000 2018,"Behind the scenes from my interview with @KyleMidura discussing my support for @realDonaldTrump's initiative to combat the #OpioidEpidemic and my bill, the Eastern Band Cherokee Historic Lands Reacquisition Act. https://t.co/JSv9WYUuE5",republicans,RepChuck
2861,Tue Mar 20 22:05:02 +0000 2018,"The Uranium Processing Facility (UPF) at @y12nsc is critical to sustaining our nuclear arsenal. I enjoyed getting to hear from the newly-confirmed @LGHNNSA about the project’s progress during the @ENERGY &amp; Water Subcommittee hearing. 

WATCH: https://t.co/CqK56o0uK9",republicans,RepChuck
2862,Tue Mar 20 19:41:21 +0000 2018,"Exciting news for #TN03! No better place for this multi-million dollar investment, and another example of the great partnership between @Volkswagen and East Tennessee. https://t.co/FgaXpq0JYq",republicans,RepChuck
2863,Tue Mar 20 16:58:58 +0000 2018,"Today is #NationalAgDay. Please join me in thanking the ranchers, farmers, and producers in East Tennessee who work long hours to fuel our nation. https://t.co/DM56vY4plF",republicans,RepChuck
2864,Mon Mar 19 21:16:57 +0000 2018,#TN03 – severe storms are expected tonight. Please stay safe! https://t.co/vpdmIHoaE8,republicans,RepChuck
2865,Sat Mar 17 15:05:48 +0000 2018,Happy #StPatricksDay! https://t.co/Unua1dOcYU,republicans,RepChuck
2866,Fri Mar 16 15:11:29 +0000 2018,Deeply saddened to hear about the passing of @louiseslaughter. She will be missed in the halls of Congress. My prayers are with her friends and family.,republicans,RepChuck
2867,Fri Mar 16 15:00:41 +0000 2018,"Yesterday, @SecretaryPerry testified before the @HouseAppropsGOP Energy &amp; Water Subcommittee. To hear his answers to my questions regarding our national labs and how we can work together to help America maintain our edge in supercomputing click → https://t.co/m5bNB1Ctgi",republicans,RepChuck
2868,Thu Mar 15 14:41:38 +0000 2018,Also happening NOW. Don't miss my questions for @SecAzar. https://t.co/a3mi78HWNK,republicans,RepChuck
2869,Thu Mar 15 14:24:02 +0000 2018,In my role on @HouseAppropsGOP Energy &amp; Water Subcommittee I will question @SecretaryPerry as he testifies on the #DepartmentofEnergy FY19 Budget. WATCH LIVE: https://t.co/xpabZjzgEz,republicans,RepChuck
2870,Wed Mar 14 19:23:04 +0000 2018,"I just voted in support of the #StopSchoolViolenceAct because, as lawmakers, we have the responsibility to do everything within our power to harden our schools. My full statement: https://t.co/Pprn8IcVo1",republicans,RepChuck
2871,Wed Mar 14 19:01:40 +0000 2018,RT @pastorofhbc: Thankful for the wonderful meeting today with @RepChuck Very gracious man who is for conservative values and religious lib…,republicans,RepChuck
2872,Wed Mar 14 14:00:20 +0000 2018,Make sure to tune in! https://t.co/ww7Fzt9kA0,republicans,RepChuck
2873,Tue Mar 13 15:22:57 +0000 2018,"Are you curious how the #TaxCutsandJobsAct will benefit your family? Now you can get answers straight to your phone. Text→ TAX REFORM to 50589 for information anytime, anywhere.",republicans,RepChuck
2874,Wed Mar 07 23:30:57 +0000 2018,"Thank you @SecretaryAcosta for your insightful answer in response to my question about #workforcedevelopment from the #LaborHHS subcommittee hearing. (2/2) 

WATCH: https://t.co/m0eqUtCGy6",republicans,RepChuck
2875,Wed Mar 07 23:29:15 +0000 2018,"Thank you @SecretaryAcosta for your insightful answer in response to my question about #workforcedevelopment from the #LaborHHS subcommittee hearing. (1/2) 

WATCH: https://t.co/Zh8tonkYO3",republicans,RepChuck
2876,Wed Mar 07 23:04:01 +0000 2018,I had the pleasure of discussing the issue of #workfocedevelopment with Labor @SecretaryAcosta during his annual hearing before the #LaborHHS subcommittee. WATCH: https://t.co/VoWIeyHu2A,republicans,RepChuck
