,created_at,full_text,party,screen_name
917,Mon Dec 25 16:58:22 +0000 2017,Merry Christmas! I pray you have a blessed holiday with family and friends and remember that Jesus is the reason for this joyous season! https://t.co/PiWYI98aXG,republicans,RepJasonSmith
918,Sun Dec 24 17:42:44 +0000 2017,"The Rolla High School choir spread Christmas cheer and performed at the Rolla Chamber of Commerce’s luncheon this week. And in West Plains, the Richards School choir performed Christmas carols. Great to see so many folks out celebrating the #Christmas season! https://t.co/cost55mh8d",republicans,RepJasonSmith
919,Sat Dec 23 19:29:54 +0000 2017,Texas &amp; Shannon Co. police &amp; fire depts held “shop with a cop &amp; firefighter” for local kids to get Christmas gifts. Funds for the shopping trip were raised by members of the community to help children in need. It is so wonderful to see folks giving back this #Christmas season. https://t.co/jDINt7JdXF,republicans,RepJasonSmith
920,Sat Dec 23 16:44:54 +0000 2017,"West Plains students participated in the “Chase the Chill” service project. In the spirit of #Christmas, the students collected donations of winter scarves and hats and left them wrapped around light poles throughout town - free to be picked up by anyone in need. https://t.co/gHGfvvtgJ0",republicans,RepJasonSmith
921,Fri Dec 22 22:24:39 +0000 2017,IT'S OFFICIAL: The #TaxCutsAndJobsAct has been signed into law by @realDonaldTrump. What an exciting time for our country - ready to see our economy unleashed. #TaxCutsForChristmas https://t.co/NagrWClW2V,republicans,RepJasonSmith
922,Wed Dec 20 22:04:06 +0000 2017,"Standing alongside @realDonaldTrump at the White House, celebrating #TaxCutsForChristmas  💵✂️🎄 #TaxCutsAndJobsAct https://t.co/j8TJKXynXu",republicans,RepJasonSmith
923,Wed Dec 20 19:18:39 +0000 2017,#BREAKING: The Tax Cuts and Jobs Act is headed to President Trump’s desk. Click to read my full statement. https://t.co/t6RfXTnaql,republicans,RepJasonSmith
924,Wed Dec 20 02:06:25 +0000 2017,"I'm here to be a voice for Missouri and remind my colleagues in Congress that tax cuts are for the middle class, NOT the wealthy coastal elite. #TaxCutsAndJobsAct https://t.co/kjSPJJ0UVZ",republicans,RepJasonSmith
925,Tue Dec 19 15:23:59 +0000 2017,"Economic security = national security, and I am proud to stand by our President as we promote American prosperity. The #TaxCutsAndJobsAct will deliver HISTORIC tax cuts and boost our economic security. 
#NationalSecurityStrategy https://t.co/Chg7owx3GF",republicans,RepJasonSmith
926,Tue Dec 19 00:16:02 +0000 2017,"The #TaxCutsAndJobsAct repeals one of the most burdensome parts of #Obamacare, the Individual Mandate. This #tax forced Missourians to buy something they didn't even want - government run healthcare. I am glad to see this burden lifted with our #TaxBill.",republicans,RepJasonSmith
927,Mon Dec 18 18:24:38 +0000 2017,"The House has passed policies to cut wasteful spending, support our troops, combat illegal immigration, reauthorize CHIP, stop regs &amp; fully repeal/replace gov takeover of healthcare. Unfortunately, the Senate can’t handle how productive we've been… https://t.co/7qXnGeAlZx",republicans,RepJasonSmith
928,Mon Dec 18 01:12:52 +0000 2017,"Retweet if you're ready for more jobs, lower taxes and a bigger paycheck. #TaxCutsAndJobsAct",republicans,RepJasonSmith
929,Sun Dec 17 23:04:04 +0000 2017,Hundreds of folks from our area came out to lay wreaths at the Bloomfield Veterans Cemetery. Praying for all families missing their veteran this holiday season. Proud to honor their sacrifices with #WreathsAcrossAmerica. https://t.co/og7wElbjt8,republicans,RepJasonSmith
930,Sat Dec 16 17:45:55 +0000 2017,"#ICYMI the #TaxCutsAndJobsAct...

❌closes loopholes that only benefit the wealthy 
📉lowers taxes for hardworking families
✂️cuts taxes for small businesses
📈makes America competitive again 

Ready to send #TaxBill to @realDonaldTrump to sign ✍🏻💵🇺🇸",republicans,RepJasonSmith
931,Fri Dec 15 20:26:09 +0000 2017,Great to see the old Melba Theatre re-opened for Christmas! Congrats to the Star Dramatic Company from Willow Springs on a great performance of The Christmas Story. https://t.co/3P7RNULABl,republicans,RepJasonSmith
932,Fri Dec 15 16:12:13 +0000 2017,"#OnThisDay in 1791, the #BillOfRights became law. Today, I am proud to fight to preserve our rights and serve as your voice in Congress. https://t.co/lcpfRveFhP",republicans,RepJasonSmith
933,Fri Dec 15 01:35:00 +0000 2017,"President Trump is rapidly cutting through regulatory red tape! So far this year, we have removed more than $8.1 billion worth of regulations that were costing YOU money. Ready to see us accomplish even more regulatory roll-backs in 2018! https://t.co/Pwjb3OoPx4",republicans,RepJasonSmith
934,Thu Dec 14 21:43:51 +0000 2017,I enjoyed having Susie Coomer and Phil Dixon from Millersville in DC. Let me know if you are planning a trip! https://t.co/E3BWUk7r4l https://t.co/5hBY8HFHaI,republicans,RepJasonSmith
935,Wed Dec 13 23:46:27 +0000 2017,Did you know that illegal immigration is at its lowest level since 1971? It is great to finally have a President who is enforcing law and order in America.,republicans,RepJasonSmith
936,Wed Dec 13 00:49:35 +0000 2017,"The Holy Land holds a special place for followers of Judaism and Christianity alike. As #Hanukkah begins tonight, we see historic US support for #Israel with @realDonaldTrump's decision to formally recognize #Jerusalem as Israel's capital 🇮🇱 https://t.co/TxrvgBTor5 https://t.co/apOEY6lTVt",republicans,RepJasonSmith
937,Tue Dec 12 22:18:15 +0000 2017,We are on track to deliver #TaxCuts for #Christmas! The Conference Committee - or the “great mixer” as President Trump likes to call it - has been working hard to make the #TaxCutsAndJobsAct even stronger. Looking forward to seeing this bill signed into law by @realDonaldTrump,republicans,RepJasonSmith
938,Tue Dec 12 19:45:15 +0000 2017,".@realDonaldTrump just signed #NDAA-legislation I helped pass. Excited to see bipartisan support on something we should all be able to rally around - our troops 🇺🇸 #FY18NDAA increases readiness &amp; gives military their biggest raise in 8 years, making us stronger than ever before",republicans,RepJasonSmith
939,Tue Dec 12 02:11:27 +0000 2017,".@realDonaldTrump announced US will move its embassy in Israel from Tel Aviv to their capital of Jerusalem. He's the first President since 1995 to follow the Jerusalem Embassy Act &amp; end 22 years of broken promises to America’s greatest ally, Israel. https://t.co/TxrvgBTor5",republicans,RepJasonSmith
940,Mon Dec 11 17:00:23 +0000 2017,"Welcome home, Staff Sergeant Probst. I pray you and your family have a very merry Christmas. Thank you for your service. https://t.co/dddUnqGmcE",republicans,RepJasonSmith
941,Sat Dec 09 20:39:11 +0000 2017,I love seeing so much #Christmas spirit across our area. Here's some pictures of the Christmas parade in Rolla. How are you celebrating the season? https://t.co/4egwIEzKtA,republicans,RepJasonSmith
942,Fri Dec 08 21:07:37 +0000 2017,"Enjoyed having JAG students from high schools across Missouri in Washington. JAG is a great program that teaches leadership skills and teamwork and helps students find jobs after graduation. 

If you're interested in visiting the Capitol, be sure to let me know! https://t.co/m3UeqH4e34",republicans,RepJasonSmith
943,Fri Dec 08 18:17:57 +0000 2017,".@USHouse has passed 449 bills during @realDonaldTrump’s first 11 months. That’s more than under Obama, Bush or Clinton. What’s also higher? The number of bills stuck in the Senate... 353. Senate liberals want to keep us from governing. #Obstruction needs to stop. https://t.co/QzrQtIPX9F",republicans,RepJasonSmith
944,Fri Dec 08 02:31:22 +0000 2017,"Incredible to see Pearl Harbor survivor and WWII Veteran, Michael Ganitch, singing #RememberPearlHarbor at the White House today. https://t.co/UDIcScesEC",republicans,RepJasonSmith
945,Thu Dec 07 20:37:52 +0000 2017,Pearl Harbor Remembrance Day ceremony on the Cape Riverfront hosted by American Legion Post 63. #RememberPearlHarbor https://t.co/groAAW5vYF,republicans,RepJasonSmith
946,Thu Dec 07 13:44:00 +0000 2017,"""A day which will live in infamy,"" FDR. Remembering all who lost their lives on this day 76 years ago. #PearlHarbor https://t.co/1fjPQGNTXT",republicans,RepJasonSmith
947,Thu Dec 07 04:16:23 +0000 2017,Lighting the @uscapitol #Christmas tree. #TisTheSeason #MerryChristmas https://t.co/H7sVrONUvc,republicans,RepJasonSmith
948,Thu Dec 07 02:53:36 +0000 2017,Liberals showed again today that they are only interested in #obstruction &amp; would rather #impeach than work with our President. My full statement 👇🏻 https://t.co/k4hw5G45mL,republicans,RepJasonSmith
949,Wed Dec 06 15:09:46 +0000 2017,Rotary Club in West Plains - members talked about the important work done by the Boys and Girls Club of America​ in the area. Always good to hear an update on community service! https://t.co/bPkTTA1g6m,republicans,RepJasonSmith
950,Tue Dec 05 21:29:45 +0000 2017,"Voted YES to stop US #tax dollars from going to terrorists w/ #TaylorForce Act. Bill passed @USHouse &amp; is named in honor of Taylor Force, @USArmy vet who was stabbed to death by a terrorist while on a trip to #Israel. #NoTaxDollarsForTerrorists ❌",republicans,RepJasonSmith
951,Tue Dec 05 17:27:50 +0000 2017,Great to see local leaders in Cape come together for the Cape Girardeau Area Chamber of Commerce First Friday Coffee. https://t.co/zvZWWqAx54,republicans,RepJasonSmith
952,Tue Dec 05 00:13:12 +0000 2017,Just voted YES to send the House &amp; Senate to #conference. Another step closer to putting the #TaxCutsAndJobsAct on @realDonaldTrump’s desk. ✅💵📈,republicans,RepJasonSmith
953,Sat Dec 02 15:13:09 +0000 2017,".@realDonaldTrump has pen in hand, ready to sign #TaxCutsAndJobsAct &amp; give folks in MO an instant pay raise. It was an honor to be part of writing &amp; passing this legislation, &amp; I will continue to work to move the bill forward until it is signed into law by our President.",republicans,RepJasonSmith
954,Sat Dec 02 15:11:40 +0000 2017,"The Senate's vote to pass legislation similar to the #TaxCutsAndJobsAct means we are one step closer to putting this bill on @realDonaldTrump's desk. The #TaxCutsAndJobsAct makes America competitive again, unleashes our economy and allows you to keep more of what you earn.",republicans,RepJasonSmith
955,Thu Nov 30 19:12:26 +0000 2017,The Tax Cuts and Jobs Act is a TAX CUT for Missouri. The Senate should work quickly to pass this bill so we can deliver an early Christmas present to folks back home. #TaxCutsAndJobsAct #TaxCuts https://t.co/FTkAV2hltR,republicans,RepJasonSmith
956,Wed Nov 29 23:23:55 +0000 2017,It was great to be with @realDonaldTrump in MO today. We are putting America &amp; Missouri FIRST with the #TaxCutsAndJobsAct 🇺🇸📈💵 full statement 👇🏻 https://t.co/QZy7K2wq72,republicans,RepJasonSmith
957,Wed Nov 29 21:08:03 +0000 2017,Listening to @realDonaldTrump talk about putting #AmericaFirst with #TaxCuts for hardworking Missourians and our plan to make America competitive again. Senate must act quickly to pass #TaxCutsAndJobsAct https://t.co/jvXpkOe85O,republicans,RepJasonSmith
958,Wed Nov 29 17:38:20 +0000 2017,"Wheels up! ✈️ 🇺🇸 @realDonaldTrump and I are on our way to Missouri to talk about #TaxCuts for middle-income families, farmers and small business owners. https://t.co/ep76QNUeO0",republicans,RepJasonSmith
959,Wed Nov 29 15:27:59 +0000 2017,I am headed to Missouri with @realDonaldTrump to talk about the importance of #TaxCuts for American families. Ready to see our economy unleashed! #TaxCutsAndJobsAct https://t.co/CM3WFbs3qf,republicans,RepJasonSmith
960,Wed Nov 29 14:57:12 +0000 2017,"We will not stand by and allow #NorthKorea to continue with this behavior. In the words of @realDonaldTrump, ""Do not try us."" https://t.co/tn6LFCtZhk",republicans,RepJasonSmith
961,Wed Nov 29 01:08:51 +0000 2017,"Whether they are fixing a WWII veteran’s house, serving a holiday meal to families in need or packing boxes for Operation Christmas Child, Missourians are great at giving back. What are your plans to #GiveBack this holiday season? #GivingTuesday https://t.co/X2YZZAyawo",republicans,RepJasonSmith
962,Tue Nov 28 23:16:57 +0000 2017,".@realDonaldTrump met with the Senate today to encourage them to move forward with the #TaxCutsAndJobsAct. The House of Representatives passed this legislation two weeks ago, and it is time for the Senate to do the same so we can deliver #TaxCuts to all Americans.",republicans,RepJasonSmith
963,Tue Nov 28 17:01:07 +0000 2017,"Have you heard? The REAL ID waiver I requested from @DHSgov was honored. I worked w/DHS to make sure you could keep your MO driver's license &amp; board a plane past 1/22/18. Today, they announced that they are granting a waiver for MO through 10/10/18. https://t.co/uOoegxoahw",republicans,RepJasonSmith
964,Tue Nov 28 03:25:21 +0000 2017,Excited to see the Pemiscot-Dunklin Electric Co-Op making progress on #RuralBroadband &amp; taking the lead on installing fiber in the Bootheel. It's important to make sure everyone from the biggest town to the smallest family farm has access to #broadband. @AjitPaiFCC https://t.co/CS3aY0zlyb,republicans,RepJasonSmith
965,Tue Nov 28 01:17:42 +0000 2017,'Tis the season! A lot of folks came out to see the @uscapitol Christmas Tree stop in Poplar Bluff on its way to Washington. We will light the tree in front of the Capitol later this week 🎄 https://t.co/QJ8bqCUOrD,republicans,RepJasonSmith
966,Mon Nov 27 22:57:03 +0000 2017,The current #tax code is 2.4 MILLION words long. Retweet if you think it is time for a change. #TaxCutsAndJobsAct,republicans,RepJasonSmith
967,Sat Nov 25 17:13:18 +0000 2017,"Today is #SmallBusinessSaturday. There are so many great small businesses in our area. They are going to be able to keep more of what they earn to hire local folks, invest in their business and grow right here in Missouri once the #TaxCutsAndJobsAct is signed by @realDonaldTrump https://t.co/jMN5mtmzhC",republicans,RepJasonSmith
968,Sat Nov 25 02:25:30 +0000 2017,Congrats to @Mizzou​ on your 48-45 victory over Arkansas!  #RivalryWeek https://t.co/e25K9TweAi,republicans,RepJasonSmith
969,Fri Nov 24 00:54:38 +0000 2017,On to dessert. #PecanPie #Thanksgiving https://t.co/xvo524b84S,republicans,RepJasonSmith
970,Thu Nov 23 20:43:23 +0000 2017,#TBT to passing the #TaxCutsAndJobsAct. Grateful to have @realDonaldTrump with us every step of the way. It’s time for the Senate to act quickly so Americans can keep more of their hard-earned money. https://t.co/RE5fQbN4wS,republicans,RepJasonSmith
971,Thu Nov 23 16:50:09 +0000 2017,#HappyThanksgiving everyone! What are you #thankful for this year? https://t.co/AO3ae9ePiT,republicans,RepJasonSmith
972,Wed Nov 22 23:50:16 +0000 2017,Getting ready for #Thanksgiving tomorrow. What are some of your favorite family traditions? #HappyThanksgiving,republicans,RepJasonSmith
973,Wed Nov 22 17:15:52 +0000 2017,Farmington City Administrator Greg Beavers gave annual State of the City report👉🏻property values⬆️&amp; unemployment⬇️ Exciting to see economy flourish under @realDonaldTrump’s leadership &amp; I know it’s going to get even better once the #TaxCutsAndJobsAct is signed into law. https://t.co/gaFhutuLRG,republicans,RepJasonSmith
974,Wed Nov 22 02:47:09 +0000 2017,"#TaxCutsAndJobsAct lets you keep ALL OF the first $24k you make, completely #TaxFree https://t.co/m4K9Nrrg1f",republicans,RepJasonSmith
975,Tue Nov 21 20:27:48 +0000 2017,.@realDonaldTrump pardons Drumstick just in time for #Thanksgiving 🦃 #TurkeyPardon https://t.co/dfNhab8MNM,republicans,RepJasonSmith
976,Tue Nov 21 03:53:49 +0000 2017,"The first female National Commander of @AmericanLegion, Denise Rohan, recently visited MO. From mentoring kids to serving vets, they do so much good for our communities. Denise is going to do a wonderful job directing this important organization. https://t.co/46JVJNrLgE",republicans,RepJasonSmith
977,Mon Nov 20 23:05:37 +0000 2017,Congratulations to Eagle Ridge Christian School Volleyball – their team won FIRST PLACE at the MCSAA state tournament. This is their second year in a row to win first place and their third state title in school history. Way to represent Missouri’s 8th Congressional District! https://t.co/F4As2hmGSR,republicans,RepJasonSmith
978,Mon Nov 20 17:07:58 +0000 2017,Who are the losers under the #TaxCutsAndJobsAct? The armies of lawyers and accountants who profit off of a complicated #tax code. The bill @HouseGOP passed last week gets rid of special interest loopholes and makes the code SIMPLE. #SimplerFairerFlatter,republicans,RepJasonSmith
979,Mon Nov 20 02:09:58 +0000 2017,.@FoxBusiness @Varneyco thanks for having me #TaxCutsAndJobsAct https://t.co/IwQVj6bO93,republicans,RepJasonSmith
980,Mon Nov 20 01:35:10 +0000 2017,Six young men take the oath to join @USArmy during #VeteransDay ceremonies at North County High School in Bonne Terre 🇺🇸 I am so impressed by their willingness to lay their lives on the line for their country &amp; pray God’s blessings upon them as they join after graduation in May https://t.co/VKeaUf9coZ,republicans,RepJasonSmith
981,Sun Nov 19 17:20:09 +0000 2017,"It was great to have Daniel, Mary Kate, Katherine, Jessica, Elizabeth and Steve from St. Pius X High School in Festus visit D.C. this week. The students are learning to be active citizens in our democracy and had a ton of great questions about government. https://t.co/e3bSbjOA5W",republicans,RepJasonSmith
982,Sun Nov 19 01:32:53 +0000 2017,"Do you make less than $55,000 per year? If so, your family of four will not have to pay one single penny in income tax. #TaxCutsAndJobsAct",republicans,RepJasonSmith
983,Sat Nov 18 21:55:59 +0000 2017,Adoption is an act of love &amp; shouldn't be punished by our #TaxCode. Proud I fought to keep #adoption tax credit in #TaxCutsAndJobsAct so MO families can continue to have the financial means to pursue what will be one of the biggest blessings in their lives. #NationalAdoptionDay,republicans,RepJasonSmith
984,Sat Nov 18 20:07:24 +0000 2017,"Today is #NationalAdoptionDay. For every family who has adopted or is waiting on a child, today is about remembering the sacrifices you’ve made and continue to make to give your kids the wonderful life they deserve. https://t.co/kjUuTDglt7",republicans,RepJasonSmith
985,Sat Nov 18 19:07:23 +0000 2017,Congratulations to Mineral Area College Volleyball on a great showing in the NJCAA National Volleyball Tournament. It’s an honor for MAC to be represented on the national level. Good luck in your next game! https://t.co/KTZumy2vRd,republicans,RepJasonSmith
986,Sat Nov 18 01:34:44 +0000 2017,Time for the Senate to act &amp; help us deliver #TaxCuts to all Americans before the end of the year. #TaxCutsAndJobsAct https://t.co/ZI7vN9izmG,republicans,RepJasonSmith
987,Fri Nov 17 01:26:04 +0000 2017,"In the words of President Donald J. Trump, ""I love you, go vote!"" 🇺🇸 And vote we did! The #TaxCutsAndJobsAct is one step closer to being on @realDonaldTrump's desk. Passed House with wide spread support. Now on to the Senate. https://t.co/Os95e3UoRF",republicans,RepJasonSmith
988,Thu Nov 16 19:41:03 +0000 2017,Tax cuts are on the way! #TaxCutsAndJobsAct PASSED ✅,republicans,RepJasonSmith
989,Thu Nov 16 01:24:21 +0000 2017,When the #TaxCutsAndJobsAct is signed into law by @realDonaldTrump you'll keep 100% of the first $24K you make. #TaxFree24K,republicans,RepJasonSmith
990,Wed Nov 15 21:42:09 +0000 2017,Our current #tax code is 2.4 MILLION words long. Americans spend 8.9 BILLION hours a year trying to comply with it... #TaxCutsAndJobsAct will fix that.,republicans,RepJasonSmith
991,Wed Nov 15 20:22:55 +0000 2017,"Enjoyed talking with folks on the tele-town-hall last night! There were so many great questions. If you didn't get to dial in, you can contact me here: https://t.co/9T6T69IqYB",republicans,RepJasonSmith
992,Tue Nov 14 23:25:45 +0000 2017,"Just Passed: The National Defense Authorization Act #FY18NDAA 

💵 Largest pay raise for our troops in 8 years 
🇺🇸 Preserves benefits for surviving military spouses
📈 Increases the size &amp; readiness of our military",republicans,RepJasonSmith
993,Tue Nov 14 21:41:14 +0000 2017,"It’s time for the #TaxCutsAndJobsAct because you know how to spend your money better than Washington. I am fighting to keep more money in your pocket so you can invest in your families, farms and small businesses – not in Washington bureaucrat’s choices.",republicans,RepJasonSmith
994,Tue Nov 14 20:26:18 +0000 2017,Don't forget to join my tele-town-hall tonight. I'll be taking your questions one everything from what's stalled in the Senate to #TaxCuts and what it's like to work with @realDonaldTrump https://t.co/ebwOKqGcWP,republicans,RepJasonSmith
995,Mon Nov 13 22:59:44 +0000 2017,"America needs the #TaxCutsAndJobsAct. Check out the record of #jobs created by #TaxCuts

✅7.8 million new jobs after Bush’s 2003 tax cuts
✅12 million new jobs after Kennedy's 1964 tax cuts
✅14.8 MILLION new jobs after Ronald Reagan’s tax cuts in 1981",republicans,RepJasonSmith
996,Mon Nov 13 21:01:22 +0000 2017,"""The purpose of cutting taxes now is not to incur a budget deficit, but to achieve the more prosperous, expanding economy...""

Most would guess President Trump, Bush, or Reagan said this, but they would be wrong... Click to see who did 👉🏻 https://t.co/pu5IMoe8Sn",republicans,RepJasonSmith
997,Mon Nov 13 17:25:46 +0000 2017,"#OnThisDay in 1982, the #VietnamWall was dedicated 🇺🇸 Recently, veterans from Perryville traveled to DC to conduct a flag exchange for the MO Veterans Memorial. I was honored to participate &amp; help bring one of our nation’s most sacred monuments to America’s heartland. https://t.co/jL5kqbPMKY",republicans,RepJasonSmith
998,Mon Nov 13 01:08:40 +0000 2017,"Join me on Tuesday to hear an update about what I'm working on in Congress. I'll be taking your questions on everything from repealing regulations, to #TaxCuts and what's stalled in the Senate. https://t.co/XxA0fRR7RE",republicans,RepJasonSmith
999,Sun Nov 12 23:14:06 +0000 2017,We made a lot of progress fighting for #TaxCuts this week. @realDonaldTrump is ready to sign the #TaxCutsAndJobsAct. I am ready to get back &amp; continue working to get Missouri families the #tax breaks they deserve.,republicans,RepJasonSmith
1000,Fri Dec 21 18:52:05 +0000 2018,"While Democrats continue their political grandstanding opposing border enforcement funding that they previously supported, it's important not to lose sight of an important policy decision implemented by DHS.  Catch and Release will now be Catch and Return.
https://t.co/oTL7OVpSSq",republicans,Rep_Hunter
1001,Thu Dec 20 22:02:55 +0000 2018,"For those who missed it, here is my interview with Brian @kilmeade on @FOXNewsradio from this morning ↓ https://t.co/vKdlEL9p41",republicans,Rep_Hunter
1002,Thu Dec 20 19:05:33 +0000 2018,"@POTUS indicating that he is holding firm on border security in the funding bill, excellent news. I am behind him 100%, spending bill must have border security.",republicans,Rep_Hunter
1003,Thu Dec 20 12:57:48 +0000 2018,Looking forward to joining Brian @kilmeade this morning to discuss the case of Maj. Mathew Golsteyn and other topics. Tune into @foxnewsradio at 10:34 am (EST) / 7:34am (PST) ↓ https://t.co/IOAOl4a5zF,republicans,Rep_Hunter
1004,Mon Dec 17 15:12:45 +0000 2018,What the Army is doing to Maj. Golsteyn is a travesty.  I’m glad @POTUS @realDonaldTrump is heeding my call to personally review the full facts of this case. Many thanks to my good friend @PeteHegseth who continues to fight on behalf of our military heroes. Read my letter ↓ https://t.co/5LUbW7d6ZQ,republicans,Rep_Hunter
1005,Mon Dec 17 02:25:38 +0000 2018,Thank you #POTUS @realDonaldTrump https://t.co/VBUCGtzSp3,republicans,Rep_Hunter
1006,Tue Dec 11 21:48:39 +0000 2018,Thank you @realDonaldTrump for standing firm on your commitment to border security.  Read my statement here → https://t.co/IIcwMdPDha,republicans,Rep_Hunter
1007,Tue Dec 11 19:05:37 +0000 2018,"Proud of @EPAAWheeler and @realDonaldTrump’s work to reverse the 2015 Obama-era #WOTUS rule. The new rule will provide ""clarity"" and ""certainty"" for our American farmers and ranchers. https://t.co/Sjl7ZQxOXy",republicans,Rep_Hunter
1008,Fri Dec 07 18:55:46 +0000 2018,"77th anniversary of Pearl Harbor – pivotal moment in U.S. history. America lost 2,403 service personnel, 68 civilians and all but 3 ships of the U.S. Pacific Fleet. Despite this loss, we gained something that day, the hard lesson that if America was to lead, we must be prepared. https://t.co/iAYeTGqahu",republicans,Rep_Hunter
1009,Tue Dec 04 19:31:49 +0000 2018,"Later today, @realDonaldTrump plans to sign the Coast Guard Authorization Act into law at the @WhiteHouse.  As an author of the bill and the former Coast Guard Subcommittee Chairman, I appreciate @POTUS strong support for the Coast Guard. https://t.co/T01riRt9A5 https://t.co/QTvZhEIbMx",republicans,Rep_Hunter
1010,Sat Dec 01 17:04:24 +0000 2018,Great American.  #GeorgeHWBush https://t.co/X5mMkcLIgF,republicans,Rep_Hunter
1011,Fri Nov 30 20:23:19 +0000 2018,"The Dept of Labor has issued guidelines providing relief for those impacted by the wildfires. Additionally, I am pleased to announce that the House passed legislation today that would, among other things, provide temporary tax relief for wildfire victims.  https://t.co/c6jf3sTbr0",republicans,Rep_Hunter
